[
  {
    "id": "std-2023-ocp-oai-liquid-cooling-guidelines",
    "type": "standard",
    "title": "OAI System Liquid Cooling Guidelines (OCP template, Mar 3 2023 update)",
    "title_zh": "OCP OAI 系统液冷指南（2023-03-03 更新版）",
    "org": "Open Compute Project, OAI Cooling workstream",
    "year": 2023,
    "venue": "OCP Server Project / OAI",
    "url": "https://www.opencompute.org/documents/oai-system-liquid-cooling-guidelines-in-ocp-template-mar-3-2023-update-pdf",
    "language": "en",
    "access": {"status": "pending_user", "license": "OCP 公开文档（OWF 等许可，以文内声明为准）", "redistributable": false,
               "how_to_get": "浏览器打开官方链接下载（脚本访问被 Cloudflare 403），放入 files/standards/ 后运行 fetch.py --verify"},
    "trust_level": "L4",
    "trust_reason": "OCP 工作组指南，文内声明不是规范（not a specification）；内容经官方域名全文取回核对",
    "stages": [1, 3, 4, 7],
    "topics": ["OCP", "OAI", "OAM", "flow rate", "temperature rise", "PG25", "case-to-inlet"],
    "summary_zh": "OAM 加速器液冷指南。§1.3 给出冷却液温升 7.5–12 °C ↔ 1.25–2.0 L/(min·kW)（按 PG25 物性），典型设计 10 °C = 1.5 L/(min·kW)；OAM 冷板典型 1–2 L/min。TTV 测试：PG25、1 kW、平整度 < 0.05 mm、相变 TIM2 时冷板热阻可低于 0.02 °C/W；PCL 测试单冷板壳–进液 0.014–0.019 °C/W（1.5–3.5 L/min）。§1.4 供液分组 Group 2 为 30–37 °C。",
    "key_data": [
      {"quantity": "推荐冷却液温升", "value": "7.5–12 °C（1.25–2.0 L/(min·kW)，按 PG25）", "unit": "°C", "condition": "OAM 系统", "locator": "§1.3 Coolant Flow Rate（目录 p.7）", "verified_from": "fulltext"},
      {"quantity": "典型设计点", "value": "10 °C 温升 = 1.5 L/(min·kW)", "unit": "-", "condition": "", "locator": "§1.3", "verified_from": "fulltext"},
      {"quantity": "OAM 冷板典型流量", "value": "1–2", "unit": "L/min", "condition": "机箱级 4–16 L/min", "locator": "§1.3", "verified_from": "fulltext"},
      {"quantity": "冷板热阻（TTV，理想条件）", "value": "< 0.02", "unit": "°C/W", "condition": "PG25 / DI，2–5 L/min，平整度 < 0.05 mm，相变 TIM2，1 kW", "locator": "TTV 测试节（§6）", "verified_from": "fulltext"},
      {"quantity": "单冷板壳–进液热阻（PCL 测试）", "value": "0.014–0.019", "unit": "°C/W", "condition": "1.5–3.5 L/min/冷板，8 × 1 kW OAM TTV，假设均匀分配", "locator": "§6.3.3 PCL Test result", "verified_from": "fulltext"},
      {"quantity": "供液分组 Group 2", "value": "30–37", "unit": "°C", "condition": "中温二次侧供液", "locator": "§1.4", "verified_from": "fulltext"}
    ],
    "benchmark_candidate": true,
    "benchmark_note": "1 kW 级 OAM 冷板的公开 TTV 壳–进液热阻量级（0.014–0.02 °C/W），可作本项目 1100–1400 W 冷板热阻目标的外部参照；几何未公开，不能作逐点验证。",
    "related_internal": ["int-2026-cpdesign-b300-report-v2-0", "int-2026-cpdesign-b300-report-v2-1-pg25"],
    "retrieved_by": "core",
    "last_verified": "2026-10-02",
    "valid_until": "2027-12-31",
    "status": "active",
    "notes": "内部 v2.1 引用的“OCP OAI 液冷指南（2023-03-03，第 1.3 节）”即本条。注意 1.25–2.0 L/(min·kW) 是按 PG25 物性换算的。"
  },
  {
    "id": "std-2023-ocp-oai-oam-base-spec-r2",
    "type": "standard",
    "title": "Open Accelerator Infrastructure (OAI) - OCP Accelerator Module (OAM) Base Specification r2.0 v1.0",
    "org": "Open Compute Project, OAI",
    "year": 2023,
    "venue": "OCP specification, 2023-09-19",
    "url": "https://www.opencompute.org/documents/oai-oam-base-specification-r2-0-v1-0-20230919-pdf",
    "language": "en",
    "access": {"status": "pending_user", "license": "OCP 规范（以文内许可为准）", "redistributable": false,
               "how_to_get": "浏览器打开官方链接下载（脚本 403）"},
    "trust_level": "L1",
    "trust_reason": "OCP 正式发布的模块基础规范；内容经官方域名全文取回核对",
    "stages": [1, 3, 7],
    "topics": ["OAM", "liquid cooling requirements", "TIM", "case-to-inlet"],
    "summary_zh": "OAM 2.0 基础规范 §7.6 液冷要求：冷板应能在 15–50 °C 供液下工作；工质为加剂处理水或 PG25 等乙二醇类；参考冷板在理想封装、TIM 面积热阻 0.1 °C·cm²/W 时壳–进液热阻最佳约 0.02 °C/W。超过 600 W 的模块建议液冷。",
    "key_data": [
      {"quantity": "冷板供液温度范围", "value": "15–50", "unit": "°C", "condition": "", "locator": "§7.6.1 Boundary Conditions", "verified_from": "fulltext"},
      {"quantity": "TIM 面积热阻（参考设计）", "value": 0.1, "unit": "°C·cm²/W", "condition": "理想封装与质量控制", "locator": "§7.6.3 Reference Coldplate Design, Fig.28–29", "verified_from": "fulltext"},
      {"quantity": "参考冷板壳–进液热阻（最佳）", "value": 0.02, "unit": "°C/W", "condition": "同上", "locator": "§7.6.3, Fig.29", "verified_from": "fulltext"},
      {"quantity": "风冷上限建议", "value": "600 W 以上模块建议液冷", "unit": "W", "condition": "", "locator": "§7 风冷段", "verified_from": "fulltext"}
    ],
    "benchmark_candidate": false,
    "related_internal": ["int-2026-cpdesign-b300-report-v2-0"],
    "retrieved_by": "core",
    "last_verified": "2026-10-02",
    "valid_until": "2027-12-31",
    "status": "active"
  },
  {
    "id": "ven-2023-meta-ocp-liquid-cooling-ai-platforms",
    "type": "vendor_doc",
    "title": "Practices and Insights into Liquid Cooling on Meta's AI Training Platforms (OCP format, Aug 14 2023)",
    "org": "Meta（OCP 贡献文档）",
    "year": 2023,
    "venue": "Open Compute Project",
    "url": "https://www.opencompute.org/documents/practices-and-insights-into-liquid-cooling-on-metas-ai-training-platforms-ocp-format-august-14-2023-pdf",
    "language": "en",
    "access": {"status": "pending_user", "license": "OCP 公开文档", "redistributable": false, "how_to_get": "浏览器打开官方链接下载（脚本 403）"},
    "trust_level": "L4",
    "trust_reason": "厂商经验白皮书，经 OCP 发布；内容经官方域名全文取回核对",
    "stages": [1, 2, 3],
    "topics": ["Meta", "TIM", "PG25", "1.5 LPM/kW", "HBM"],
    "summary_zh": "Meta AI 训练平台液冷实践。分析边界条件：TIM 0.2 °C·cm²/W；AALC 为 PG25、40 °C 供液、1.5 L/(min·kW)；FWC 为 PG25、30 °C 供液、1.5 L/(min·kW)。",
    "key_data": [
      {"quantity": "TIM 面积热阻（分析假设）", "value": 0.2, "unit": "°C·cm²/W", "condition": "L10 边界条件", "locator": "分析边界条件列表", "verified_from": "fulltext"},
      {"quantity": "AALC 边界", "value": "PG25，40 °C 供液，1.5 L/(min·kW)", "unit": "-", "condition": "", "locator": "同上", "verified_from": "fulltext"},
      {"quantity": "FWC 边界", "value": "PG25，30 °C 供液，1.5 L/(min·kW)", "unit": "-", "condition": "", "locator": "同上", "verified_from": "fulltext"}
    ],
    "benchmark_candidate": false,
    "related_internal": ["int-2026-cpdesign-b300-report-v2-0"],
    "retrieved_by": "core",
    "last_verified": "2026-10-02",
    "valid_until": "2027-12-31",
    "status": "active",
    "notes": "内部 v2.0 “TIM2 面积热阻 0.1–0.2 °C·cm²/W（OCP / Meta 公开资料）”的两端分别对应 OAM 规范 0.1 与本条 0.2。"
  },
  {
    "id": "ven-2022-nvidia-h100-pcie-product-brief",
    "type": "vendor_doc",
    "title": "NVIDIA H100 PCIe GPU Product Brief (PB-11133-001_v02)",
    "org": "NVIDIA",
    "year": 2022,
    "venue": "NVIDIA Product Brief, Nov 2022",
    "identifiers": {"std_no": "PB-11133-001_v02"},
    "url": "https://www.nvidia.com/content/dam/en-zz/Solutions/gtcs22/data-center/h100/PB-11133-001_v01.pdf",
    "language": "en",
    "access": {"status": "downloaded", "license": "NVIDIA 官网公开文档，版权保留", "redistributable": false},
    "file": {"path": "files/vendor_docs/ven-2022-nvidia-h100-pcie-product-brief.pdf", "sha256": "66ed708d7fb1a7dc5adb83e4852243a99c47d0c19afb3d501211f052f6d28fa7", "bytes": 787501, "pages": 23,
             "source_url": "https://www.nvidia.com/content/dam/en-zz/Solutions/gtcs22/data-center/h100/PB-11133-001_v01.pdf", "downloaded_at": "2026-10-02"},
    "trust_level": "L3",
    "trust_reason": "NVIDIA 官方产品简介；但对象是 H100 PCIe，不是 B300",
    "stages": [1, 3],
    "topics": ["H100", "HBM temperature", "thermal specifications", "代理值"],
    "summary_zh": "H100 PCIe 产品简介。Table 5 热规格：GPU 热鉴定温度 T_AVG = 87 °C，HBM T_HBM = 95 °C；Table 4 定义 T_AVG、T_LIMIT、T_HBM。B300 没有公开等价表，内部报告把这里的 HBM 95 °C 当绝对温度参照。",
    "key_data": [
      {"quantity": "GPU 热鉴定温度 T_AVG", "value": 87, "unit": "°C", "condition": "H100 PCIe", "locator": "p.10 Table 5", "verified_from": "fulltext"},
      {"quantity": "HBM 热鉴定温度 T_HBM", "value": 95, "unit": "°C", "condition": "H100 PCIe", "locator": "p.10 Table 5", "verified_from": "fulltext"},
      {"quantity": "温度定义", "value": "T_AVG 全部 GPU 内部传感器平均；T_HBM 全部 HBM 传感器最大值", "unit": "-", "condition": "", "locator": "p.9 Table 4", "verified_from": "fulltext"}
    ],
    "benchmark_candidate": false,
    "related_internal": ["int-2026-cpdesign-b300-report-v2-1-pg25", "int-2026-cpdesign-b300-report-v2-0"],
    "retrieved_by": "core",
    "last_verified": "2026-10-02",
    "valid_until": "2027-12-31",
    "status": "active",
    "notes": "内部 v2.0 热阻预算用 Tj,max = 90 °C，没有给出处；最接近的公开一手值是本表 H100 的 T_AVG 87 °C（不同产品、不同定义）。"
  }
]
