[
  {
    "id": "dat-2023-nist-water-isobar-1atm",
    "type": "dataset",
    "title": "Thermophysical Properties of Fluid Systems: Water, isobaric 0.101325 MPa, 20–80 °C",
    "title_zh": "NIST 化学网络手册·流体热物性：水，0.101325 MPa 等压，20–80 °C",
    "org": "NIST (Lemmon, McLinden, Friend; IAPWS-95 / IAPWS 2008 viscosity / IAPWS 2011 conductivity)",
    "year": 2023,
    "venue": "NIST Chemistry WebBook, SRD 69",
    "identifiers": {"doi": "10.18434/T4D303"},
    "url": "https://webbook.nist.gov/chemistry/fluid/",
    "language": "en",
    "access": {"status": "downloaded", "license": "NIST 标准参考数据（美国政府作品，版权按 NIST SRD 条款）", "redistributable": true},
    "file": {"path": "files/datasets/dat-2023-nist-water-isobar-1atm.txt", "sha256": "42227259efc52ff8a7308190380b4246a222faedafad122101cb084e9f991991", "bytes": 1820, "source_url": "https://webbook.nist.gov/cgi/fluid.cgi?Action=Data&Wide=on&ID=C7732185&Type=IsoBar&Digits=6&P=0.101325&THigh=80&TLow=20&TInc=5&RefState=DEF&TUnit=C&PUnit=MPa&DUnit=kg%2Fm3&HUnit=kJ%2Fkg&WUnit=m%2Fs&VisUnit=Pa*s&STUnit=N%2Fm", "downloaded_at": "2026-10-02"},
    "trust_level": "L1",
    "trust_reason": "国家计量机构标准参考数据，基于 IAPWS 国际公式",
    "stages": [3, 4, 5, 7],
    "topics": ["water properties", "IAPWS", "水物性", "baseline"],
    "summary_zh": "水在 1 atm 下 20–80 °C 每 5 °C 的密度、比热、粘度、导热系数。用于核对内部水基线物性，也是 PG25 物性回归时 0% 浓度端点。",
    "key_data": [
      {"quantity": "密度 ρ", "value": 992.216, "unit": "kg/m3", "condition": "40 °C, 0.101325 MPa", "locator": "表行 T=40.0000", "verified_from": "fulltext"},
      {"quantity": "比热 cp", "value": 4.17941, "unit": "kJ/(kg·K)", "condition": "40 °C", "locator": "表行 T=40.0000", "verified_from": "fulltext"},
      {"quantity": "动力粘度 μ", "value": 0.000652729, "unit": "Pa·s", "condition": "40 °C", "locator": "表行 T=40.0000", "verified_from": "fulltext"},
      {"quantity": "导热系数 k", "value": 0.628486, "unit": "W/(m·K)", "condition": "40 °C", "locator": "表行 T=40.0000", "verified_from": "fulltext"},
      {"quantity": "普朗特数 Pr（由上三列算得）", "value": 4.34, "unit": "-", "condition": "40 °C", "locator": "由表行 T=40 计算", "verified_from": "fulltext"},
      {"quantity": "动力粘度 μ", "value": 0.000595769, "unit": "Pa·s", "condition": "45 °C", "locator": "表行 T=45.0000", "verified_from": "fulltext"}
    ],
    "benchmark_candidate": true,
    "benchmark_note": "物性基准：一维工具与 Fluent 材料库的水物性应与本表一致（相对偏差 < 0.5%）。",
    "related_internal": ["int-2026-cpdesign-b300-report-v2-0", "int-2026-cpdesign-b300-report-v2-1-pg25"],
    "retrieved_by": "core",
    "last_verified": "2026-10-02",
    "valid_until": "2030-12-31",
    "status": "active"
  },
  {
    "id": "hbk-2026-cda-copper-tube-handbook",
    "type": "handbook",
    "title": "The Copper Tube Handbook",
    "title_zh": "铜管手册（美国铜业发展协会）",
    "org": "Copper Development Association (CDA)",
    "year": 2026,
    "venue": "CDA Publication A4015",
    "url": "https://copper.org/markets-and-applications/building-construction/strengthening-plumbing-systems/copper-tube-handbook/",
    "language": "en",
    "access": {"status": "downloaded", "license": "CDA 官网免费公开，版权保留", "redistributable": false},
    "file": {"path": "files/handbooks/hbk-2026-cda-copper-tube-handbook.pdf", "sha256": "01182730b02a2245875eb7fbc94b3df3fdcf8e974660ba80c7094325abb98d2d", "bytes": 22634208, "pages": 96, "source_url": "https://copper.org/wp-content/uploads/2026/04/copper_tube_handbook.pdf", "downloaded_at": "2026-10-02"},
    "trust_level": "L1",
    "trust_reason": "行业协会权威手册，被北美管道规范广泛引用；但针对建筑给水铜管，不是微通道冷板",
    "stages": [2, 3, 6],
    "topics": ["erosion-corrosion", "velocity limit", "copper", "流速上限", "冲刷腐蚀"],
    "summary_zh": "铜管水系统设计手册。给出防止冲刷腐蚀的流速上限：冷水 8 ft/s，60 °C 以下热水 5 ft/s，长期 >60 °C 为 2–3 ft/s，½ 英寸及以下小管应更低。这是项目“孔速 ≤ 2.0 m/s、近壁 ≤ 0.80 m/s”唯一能找到的公开权威参照；但它针对管道而不是短孔射流，只能作量级参照。",
    "key_data": [
      {"quantity": "冷水最大流速", "value": "8 ft/s ≈ 2.44 m/s", "unit": "m/s", "condition": "防噪声与冲刷腐蚀", "locator": "p.15 Water Velocity Limitations", "verified_from": "fulltext"},
      {"quantity": "热水最大流速", "value": "5 ft/s ≈ 1.52 m/s", "unit": "m/s", "condition": "水温至约 140 °F (60 °C)", "locator": "p.15", "verified_from": "fulltext"},
      {"quantity": "高温热水最大流速", "value": "2–3 ft/s ≈ 0.61–0.91 m/s", "unit": "m/s", "condition": "长期 > 140 °F", "locator": "p.15", "verified_from": "fulltext"},
      {"quantity": "小管附加要求", "value": "½ in 及以下宜取更低流速", "unit": "-", "condition": "毛刺、急转弯引起局部高速湍流", "locator": "p.15", "verified_from": "fulltext"},
      {"quantity": "侵蚀腐蚀综合限值", "value": "5–8 ft/s，下限用于小管径", "unit": "ft/s", "condition": "", "locator": "p.27；Table 14.6 注 1 p.80", "verified_from": "fulltext"}
    ],
    "benchmark_candidate": false,
    "related_internal": ["int-2026-cpdesign-b300-report-v2-1-pg25"],
    "retrieved_by": "core",
    "last_verified": "2026-10-02",
    "valid_until": "2030-12-31",
    "status": "active",
    "notes": "40 °C PG25 属“热水”档，按本手册应取 ≤ 1.52 m/s。v2.1 的 0.40 mm 孔在 2.6 L/min 时孔速 1.596 m/s，略超此参照；0.50 mm 为 1.022 m/s。"
  },
  {
    "id": "dat-0000-cda-c11000-properties",
    "type": "dataset",
    "title": "C11000 Electrolytic Tough Pitch (ETP) Copper — alloy properties",
    "title_zh": "C11000 电解韧铜（ETP）物性页",
    "org": "Copper Development Association (CDA)",
    "year": 0,
    "venue": "CDA Alloy Database",
    "url": "https://alloys.copper.org/alloy/C11000",
    "language": "en",
    "access": {"status": "downloaded", "license": "CDA 官网公开网页，版权保留", "redistributable": false},
    "file": {"path": "files/datasets/dat-0000-cda-c11000-properties.html", "sha256": "33002ed30605168d927c1952caa8a5fe022725d74dfc8db5451743904c1b0150", "bytes": 219768, "source_url": "https://alloys.copper.org/alloy/C11000", "downloaded_at": "2026-10-02"},
    "trust_level": "L1",
    "trust_reason": "铜业协会合金数据库，行业基准物性",
    "stages": [3, 4, 5],
    "topics": ["copper", "thermal conductivity", "C11000", "紫铜", "导热率"],
    "summary_zh": "C11000 紫铜物性：20 °C 导热率 226 Btu/(ft·h·°F) ≈ 391 W/(m·K)，比重 8.91，电导率 101% IACS。支持内部 k_Cu = 390 W/(m·K)。",
    "key_data": [
      {"quantity": "导热率", "value": "226 Btu/(ft·h·°F) ≈ 391 W/(m·K)", "unit": "W/(m·K)", "condition": "68 °F (20 °C)", "locator": "Physical Properties 表", "verified_from": "fulltext"},
      {"quantity": "比重", "value": 8.91, "unit": "-", "condition": "", "locator": "Physical Properties 表", "verified_from": "fulltext"},
      {"quantity": "电导率", "value": 101, "unit": "% IACS", "condition": "68 °F", "locator": "Physical Properties 表", "verified_from": "fulltext"}
    ],
    "benchmark_candidate": false,
    "related_internal": ["int-2026-cpdesign-b300-report-v2-0"],
    "retrieved_by": "core",
    "last_verified": "2026-10-02",
    "valid_until": "2030-12-31",
    "status": "active",
    "notes": "网页只给 20 °C 值；工作温度下的修正需另找来源。钎焊退火后的实件导热率应以实测或材料证书为准。"
  }
]
